{
  "schema_version": 1,
  "rule_id": "synthetic-online-cashback-v1",
  "card_variant_id": "synthetic-variant",
  "rule_type": "cashback_rate",
  "parameters": {
    "rate_percent": "5.0",
    "cap_amount": "500.00",
    "cap_period": "calendar_month",
    "eligible_categories": ["online_shopping"],
    "eligible_channels": ["online_card"]
  },
  "effective_from": "2026-01-01",
  "effective_to": null,
  "verification_status": "draft",
  "evidence_ids": [],
  "notes": "Fictional test fixture; not a real issuer offer."
}
